{
  "$schema": "https://json-schema.org/draft/2020-12/schema",
  "$id": "https://example.org/schemas/valve_profile.schema.json",
  "title": "ValveProfile",
  "type": "object",
  "additionalProperties": false,
  "required": [
    "valve_tag",
    "valve_type",
    "function",
    "actuation_type",
    "code_class",
    "safety_classification",
    "seismic_category",
    "environment_profile"
  ],
  "properties": {
    "profile_id": {
      "type": "string",
      "description": "Optional unique ID for this valve profile."
    },
    "valve_tag": {
      "type": "string"
    },
    "valve_type": {
      "type": "string",
      "enum": [
        "gate",
        "globe",
        "check",
        "ball",
        "butterfly",
        "relief",
        "other"
      ]
    },
    "function": {
      "type": "string",
      "enum": [
        "isolation",
        "flow_control",
        "non_return",
        "overpressure_protection"
      ]
    },
    "actuation_type": {
      "type": "string",
      "enum": [
        "manual",
        "MOV",
        "AOV",
        "SOV",
        "HOV"
      ]
    },
    "code_class": {
      "type": "string",
      "enum": [
        "ASME_III_Class_1",
        "ASME_III_Class_2",
        "ASME_III_Class_3",
        "NonCode"
      ]
    },
    "safety_classification": {
      "type": "string",
      "enum": [
        "safety_related",
        "non_safety",
        "risk_informed"
      ]
    },
    "seismic_category": {
      "type": "string",
      "enum": [
        "Seismic_Category_I",
        "Seismic_Category_II",
        "NonSeismic"
      ]
    },
    "environment_profile": {
      "type": "string",
      "enum": [
        "mild",
        "harsh",
        "DBA_profile_defined"
      ]
    },
    "design_pressure": {
      "type": [
        "number",
        "null"
      ],
      "description": "MPa"
    },
    "design_temperature": {
      "type": [
        "number",
        "null"
      ],
      "description": "C"
    },
    "dp_max": {
      "type": [
        "number",
        "null"
      ],
      "description": "MPa"
    },
    "flowrate_max": {
      "type": [
        "number",
        "null"
      ],
      "description": "kg/s"
    },
    "stroke_time_limit": {
      "type": [
        "number",
        "null"
      ],
      "description": "s"
    },
    "seat_leakage_limit": {
      "type": [
        "string",
        "null"
      ]
    },
    "relief_setpoint": {
      "type": [
        "number",
        "null"
      ],
      "description": "MPa (only if relief valve)"
    },
    "service_life_years": {
      "type": [
        "number",
        "null"
      ],
      "description": "years"
    },
    "design_cycles": {
      "type": [
        "number",
        "null"
      ],
      "description": "cycles"
    },
    "metadata": {
      "type": "object",
      "additionalProperties": true,
      "description": "Optional free-form metadata (system, location, notes, hazards, etc.)."
    }
  }
}